{
  "schema_version": "1.0",
  "outcomes_id": "cloud-security-baseline-outcomes",
  "outcomes_version": "1.0.0",
  "status": "frozen",
  "created_on": "2026-08-13",
  "protocol": {
    "path": "evaluation/protocol-v1.0.json",
    "version": "1.0.0",
    "sha256": "23523b0d79f16cd06604c1db5966ba2b4100c53005e4cb45639870698053977d"
  },
  "corpus": {
    "path": "evaluation/corpus-manifest-v1.0.json",
    "version": "1.0.0",
    "sha256": "9e9eb0f1d5fa84f4926b7665cc5b3738c481a0caa0c11ad55ed4ae4df1142f59"
  },
  "overlap_matrix": {
    "path": "evaluation/baseline-overlap-v1.0.json",
    "version": "1.0.0",
    "sha256": "2e7652643f9df31b421567ac11138707ebc373522ad0cc1ce03b1bb74f6aad49"
  },
  "method": {
    "type": "source-audited-predicate-replay",
    "candidate_executed": false,
    "candidate_imported": false,
    "truth_labels_consumed": false,
    "input_variant_policy": "one-declared-simplified-variant-per-case",
    "statement": "Only rule-level exact mappings are replayed. The runner reads decision-key identity and retained evidence but never reads assertion labels, expected severity, or candidate output."
  },
  "baseline_runs": [
    {
      "baseline_id": "prowler-aws",
      "version": "5.38.0",
      "commit_sha": "b21ddad32c6d9a98eb819f0ccadac8a6792c2837",
      "execution_mode": "source-audited-predicate-replay",
      "upstream_tool_executed": false,
      "exact_rule_count": 5,
      "decision_count": 24,
      "positive_prediction_count": 11,
      "negative_prediction_count": 13,
      "exclusion_count": 97,
      "source_predicates": [
        {
          "lab_rule_id": "IAM-006",
          "baseline_check_id": "iam_user_mfa_enabled_console_access",
          "source_path": "prowler/providers/aws/services/iam/iam_user_mfa_enabled_console_access/iam_user_mfa_enabled_console_access.py",
          "source_url": "https://github.com/prowler-cloud/prowler/blob/b21ddad32c6d9a98eb819f0ccadac8a6792c2837/prowler/providers/aws/services/iam/iam_user_mfa_enabled_console_access/iam_user_mfa_enabled_console_access.py",
          "sha256": "4d0e89d92560c8e81a167524866d6f84eb23b7163736b7b22df59ac7ed653aff"
        },
        {
          "lab_rule_id": "IAM-007",
          "baseline_check_id": "iam_rotate_access_key_90_days",
          "source_path": "prowler/providers/aws/services/iam/iam_rotate_access_key_90_days/iam_rotate_access_key_90_days.py",
          "source_url": "https://github.com/prowler-cloud/prowler/blob/b21ddad32c6d9a98eb819f0ccadac8a6792c2837/prowler/providers/aws/services/iam/iam_rotate_access_key_90_days/iam_rotate_access_key_90_days.py",
          "sha256": "353e7e4bd0837f2e376dcaddfbce664a1cb70c5977db683a770cd1621be7fa6b"
        },
        {
          "lab_rule_id": "IAM-013",
          "baseline_check_id": "iam_no_root_access_key",
          "source_path": "prowler/providers/aws/services/iam/iam_no_root_access_key/iam_no_root_access_key.py",
          "source_url": "https://github.com/prowler-cloud/prowler/blob/b21ddad32c6d9a98eb819f0ccadac8a6792c2837/prowler/providers/aws/services/iam/iam_no_root_access_key/iam_no_root_access_key.py",
          "sha256": "354dc5b14bb85eaa62f98af69a8bcbd109246240d61c4d0eb03524b8ae94d2c5"
        },
        {
          "lab_rule_id": "STO-004",
          "baseline_check_id": "s3_bucket_default_encryption",
          "source_path": "prowler/providers/aws/services/s3/s3_bucket_default_encryption/s3_bucket_default_encryption.py",
          "source_url": "https://github.com/prowler-cloud/prowler/blob/b21ddad32c6d9a98eb819f0ccadac8a6792c2837/prowler/providers/aws/services/s3/s3_bucket_default_encryption/s3_bucket_default_encryption.py",
          "sha256": "56099ab4219c92c9c41c13e047bba758071373f0dbd6ead75d3de13abe436130"
        },
        {
          "lab_rule_id": "STO-005",
          "baseline_check_id": "s3_bucket_object_versioning",
          "source_path": "prowler/providers/aws/services/s3/s3_bucket_object_versioning/s3_bucket_object_versioning.py",
          "source_url": "https://github.com/prowler-cloud/prowler/blob/b21ddad32c6d9a98eb819f0ccadac8a6792c2837/prowler/providers/aws/services/s3/s3_bucket_object_versioning/s3_bucket_object_versioning.py",
          "sha256": "4af640e1f646823133d13c6c06a95c4f352dd9f8f62497eacf1b3b7f1dd752f3"
        }
      ],
      "release_inventory": [],
      "notes": "The full Prowler CLI was not run against a live account. Exact 5.38.0 check predicates were independently replayed over equivalent retained fields, with source paths and file digests preserved."
    },
    {
      "baseline_id": "sigma-core",
      "version": "r2026-07-01",
      "commit_sha": "552f3fee420ef232a8e5790c4fae591847e32347",
      "execution_mode": "no-exact-overlap",
      "upstream_tool_executed": false,
      "exact_rule_count": 0,
      "decision_count": 0,
      "positive_prediction_count": 0,
      "negative_prediction_count": 0,
      "exclusion_count": 55,
      "source_predicates": [],
      "release_inventory": [
        {
          "source_path": "rules/cloud/aws/cloudtrail/aws_cloudtrail_imds_malicious_usage.yml",
          "source_url": "https://github.com/SigmaHQ/sigma/blob/552f3fee420ef232a8e5790c4fae591847e32347/rules/cloud/aws/cloudtrail/aws_cloudtrail_imds_malicious_usage.yml",
          "sha256": "b070399db57d212727d7f7873c642a0c1da0930c2b45a5fe8945c3e2474caf37"
        },
        {
          "source_path": "rules/cloud/aws/cloudtrail/aws_cloudtrail_ssm_malicious_usage.yml",
          "source_url": "https://github.com/SigmaHQ/sigma/blob/552f3fee420ef232a8e5790c4fae591847e32347/rules/cloud/aws/cloudtrail/aws_cloudtrail_ssm_malicious_usage.yml",
          "sha256": "3d394a4a27a2af7c93034177c376f0358e13b29999074dda031334b7c92b2cc9"
        },
        {
          "source_path": "rules/cloud/aws/cloudtrail/aws_config_disable_recording.yml",
          "source_url": "https://github.com/SigmaHQ/sigma/blob/552f3fee420ef232a8e5790c4fae591847e32347/rules/cloud/aws/cloudtrail/aws_config_disable_recording.yml",
          "sha256": "d53eb7e1c2b87a31bd7ca7558f3eda1d15ceb4646451e8e0405d78618480aea6"
        },
        {
          "source_path": "rules/cloud/aws/cloudtrail/aws_ec2_startup_script_change.yml",
          "source_url": "https://github.com/SigmaHQ/sigma/blob/552f3fee420ef232a8e5790c4fae591847e32347/rules/cloud/aws/cloudtrail/aws_ec2_startup_script_change.yml",
          "sha256": "8b58ce7431b1b3964cf0239c95164d92c9ce51c941101f70d901f7ff3b71b727"
        },
        {
          "source_path": "rules/cloud/aws/cloudtrail/aws_guardduty_disruption.yml",
          "source_url": "https://github.com/SigmaHQ/sigma/blob/552f3fee420ef232a8e5790c4fae591847e32347/rules/cloud/aws/cloudtrail/aws_guardduty_disruption.yml",
          "sha256": "b82f5f5ef3080814b9bbf019a07f7ddf0313afd1e08b8eca3e5331b6bbf3a01c"
        },
        {
          "source_path": "rules/cloud/aws/cloudtrail/aws_iam_s3browser_loginprofile_creation.yml",
          "source_url": "https://github.com/SigmaHQ/sigma/blob/552f3fee420ef232a8e5790c4fae591847e32347/rules/cloud/aws/cloudtrail/aws_iam_s3browser_loginprofile_creation.yml",
          "sha256": "981a9406ac25d4b00b2dfd446c87a14b3f22cc03f54f03c7b6229a3ac507c371"
        },
        {
          "source_path": "rules/cloud/aws/cloudtrail/aws_iam_s3browser_templated_s3_bucket_policy_creation.yml",
          "source_url": "https://github.com/SigmaHQ/sigma/blob/552f3fee420ef232a8e5790c4fae591847e32347/rules/cloud/aws/cloudtrail/aws_iam_s3browser_templated_s3_bucket_policy_creation.yml",
          "sha256": "f2a68159a3037c9511c3c74d3d027fc367dc9c4662df6c6f03723554aa92d245"
        },
        {
          "source_path": "rules/cloud/aws/cloudtrail/aws_iam_s3browser_user_or_accesskey_creation.yml",
          "source_url": "https://github.com/SigmaHQ/sigma/blob/552f3fee420ef232a8e5790c4fae591847e32347/rules/cloud/aws/cloudtrail/aws_iam_s3browser_user_or_accesskey_creation.yml",
          "sha256": "c566f779298d219eb9733ec7db1e554ff269f748f71b3fffd4eb9ff09adf53fe"
        },
        {
          "source_path": "rules/cloud/aws/cloudtrail/aws_rds_public_db_restore.yml",
          "source_url": "https://github.com/SigmaHQ/sigma/blob/552f3fee420ef232a8e5790c4fae591847e32347/rules/cloud/aws/cloudtrail/aws_rds_public_db_restore.yml",
          "sha256": "b15f0a86150e455237cd494602cd4305a500afbf1ebd61a4164129d665cafcbe"
        },
        {
          "source_path": "rules/cloud/aws/cloudtrail/aws_securityhub_finding_evasion.yml",
          "source_url": "https://github.com/SigmaHQ/sigma/blob/552f3fee420ef232a8e5790c4fae591847e32347/rules/cloud/aws/cloudtrail/aws_securityhub_finding_evasion.yml",
          "sha256": "865044229606ad4a1bc676f90a7c5edb0de04a5b9f518b69888648aee3480e91"
        },
        {
          "source_path": "rules/cloud/aws/cloudtrail/aws_sso_idp_change.yml",
          "source_url": "https://github.com/SigmaHQ/sigma/blob/552f3fee420ef232a8e5790c4fae591847e32347/rules/cloud/aws/cloudtrail/aws_sso_idp_change.yml",
          "sha256": "7ea2c37b143dacc7c240f87d69212a325155090b3535baa33ba38e8a7f58f145"
        },
        {
          "source_path": "rules/cloud/aws/cloudtrail/aws_update_login_profile.yml",
          "source_url": "https://github.com/SigmaHQ/sigma/blob/552f3fee420ef232a8e5790c4fae591847e32347/rules/cloud/aws/cloudtrail/aws_update_login_profile.yml",
          "sha256": "d29c571268666e01c24c0f3492b7fc04ccb66b165294c79c3b9afac57db80af6"
        }
      ],
      "notes": "The verified r2026-07-01 sigma_core.zip asset contains no released rule whose complete predicate is equivalent to a lab CloudTrail rule, so no Sigma decision is eligible for agreement scoring."
    }
  ],
  "summary": {
    "corpus_case_count": 32,
    "corpus_assertion_count": 176,
    "baseline_eligible_case_count": 24,
    "exact_rule_count": 5,
    "partial_rule_count": 18,
    "no_counterpart_rule_count": 12,
    "decision_count": 24,
    "positive_prediction_count": 11,
    "negative_prediction_count": 13,
    "exclusion_count": 152
  },